{
  "$id": "frp.m29.canonical_demo_artifact_package.v3.1.0",
  "$schema": "https://json-schema.org/draft/2020-12/schema",
  "additionalProperties": false,
  "properties": {
    "kind": {
      "type": "string"
    },
    "member_count": {
      "minimum": 0,
      "type": "integer"
    },
    "members": {
      "type": "array"
    },
    "milestone": {
      "const": "M29",
      "type": "string"
    },
    "package_digest": {
      "pattern": "^[0-9a-f]{64}$",
      "type": "string"
    },
    "package_id": {
      "type": "string"
    },
    "schema": {
      "const": "frp.m29.canonical_demo_artifact_package.v3.1.0",
      "type": "string"
    },
    "source_commit": {
      "const": "a1c0bb2fa0a4731b9339e6cd996589e1bf226c04",
      "type": "string"
    },
    "status": {
      "const": "PASS",
      "type": "string"
    },
    "transport_contract": {
      "type": "object"
    },
    "version": {
      "const": "3.1.0",
      "type": "string"
    }
  },
  "required": [
    "schema",
    "kind",
    "milestone",
    "version",
    "source_commit",
    "package_id",
    "member_count",
    "members",
    "transport_contract",
    "status",
    "package_digest"
  ],
  "title": "frp.m29.canonical_demo_artifact_package.v3.1.0",
  "type": "object"
}
