{
  "kind": "canonical_demo_artifact_package",
  "member_count": 4,
  "members": [
    {
      "byte_length": 9013,
      "copy_requirement": "unchanged_upstream_bytes",
      "measurement_contour": "m16_fpga_preparation_execution",
      "media_type": "application/json",
      "member_id": "m16-fpga-preparation-execution-trace",
      "observatory_modes": [
        "artifact_auditor",
        "ternary_transition_visualizer",
        "trace_explorer"
      ],
      "payload_base64": "eyJjb25maWd1cmF0aW9uIjp7ImNlbGxzIjo4LCJjb3VudGVyX2JpdHMiOjMyLCJyZXF1ZXN0X2xhbmVzIjoyLCJzdGF0ZV9iaXRzIjoyLCJ0cmFuc2l0aW9uX2ZyYWN0aW9uX2Rlbm9taW5hdG9yIjo0LCJ0cmFuc2l0aW9uX2ZyYWN0aW9uX251bWVyYXRvciI6MX0sImV4ZWN1dGlvbl9lcG9jaHMiOlt7ImVwb2NoIjowLCJtb2RlIjoiZnJlZSIsInJlY29yZF9jb3VudCI6M30seyJlcG9jaCI6MSwibW9kZSI6IjEvNyIsInJlY29yZF9jb3VudCI6MX1dLCJraW5kIjoibTE2X2ZwZ2FfcHJlcGFyYXRpb25fZXhlY3V0aW9uX3RyYWNlIiwibGF5ZXIiOiJmcGdhX3ByZXBhcmF0aW9uIiwibWVhc3VyZW1lbnRfY29udG91cnMiOnsibTE1X3NlbWFudGljX3JlZmVyZW5jZSI6eyJhcnRpZmFjdHMiOlt7InBhdGgiOiJhcnRpZmFjdHMvbTE4L3N0cnVjdHVyZWRfb3V0cHV0L3RyYWNlLWZyZWUuanNvbiIsInJhd19zaGEyNTYiOiIyYzVmMDg3MzYxYTFkMjhlY2Y2NDc4Mjg5MDcxYmU2YjRkY2U3OWMwNWNjODk5MjAxMDE4NWEyZjU4NGFkNjg2IiwicmVjb3JkX2NvdW50Ijo2NCwic2NoZW1hIjoiZnJwLnN0cnVjdHVyZWRfb3V0cHV0LnYxLjcuMCJ9LHsicGF0aCI6ImFydGlmYWN0cy9tMTgvc3RydWN0dXJlZF9vdXRwdXQvdHJhY2UtNy0xLmpzb24iLCJyYXdfc2hhMjU2IjoiNTViMmYzZTcxNDk0YjZhZmU3MzdmYTNjODJjMzAxMDExZmI1NjBhOTUyYjFkMzU2NzQwZjc5YzAzZjRlZDVhOSIsInJlY29yZF9jb3VudCI6NjQsInNjaGVtYSI6ImZycC5zdHJ1Y3R1cmVkX291dHB1dC52MS43LjAifSx7InBhdGgiOiJhcnRpZmFjdHMvbTE4L3N0cnVjdHVyZWRfb3V0cHV0L3RyYWNlLTEtNy5qc29uIiwicmF3X3NoYTI1NiI6IjdhNGNkNDM4OGRmNGU1OWFmZWUwMWYxODU5ODMwNGRkNDFiZGY5NjNlNTE4NjY4M2I0ZmE0N2ZmODczMmM0YzYiLCJyZWNvcmRfY291bnQiOjY0LCJzY2hlbWEiOiJmcnAuc3RydWN0dXJlZF9vdXRwdXQudjEuNy4wIn1dLCJhdmFpbGFiaWxpdHkiOiJleHRlcm5hbF91cHN0cmVhbV9jYW5vbmljYWxfYXJ0aWZhY3RzIiwiY29ycmVsYXRpb25fc3RhdHVzIjoibm90X2V2YWx1YXRlZF9pbl9tMTkiLCJxdWFudGl0aWVzIjpbIkNfcTE2IiwiUF9xMTYiLCJDX21pbnVzX1BfcTE2IiwiZ2xvYmFsX3BoYXNlX2NvaGVyZW5jZV9xMzAiLCJoZWF0X2dsb2JhbF9xMTYiXX0sIm0xNl9leGVjdXRpb24iOnsiYXZhaWxhYmlsaXR5IjoiZW1pdHRlZF9ieV9tMTZfZXhlY3V0aW9uX2JvdW5kYXJ5IiwicXVhbnRpdGllcyI6WyJhY2NlcHRlZF9jaGFuZ2VzIiwiY2FwYWNpdHlfcmVtYWluaW5nIiwic3dpdGNoX2xvYWRfbnVtZXJhdG9yIiwic3dpdGNoX2xvYWRfcTE2IiwicmVxdWVzdGVkX2RpcmVjdF9ldmVudHMiLCJwcmV2ZW50ZWRfZGlyZWN0X2V2ZW50cyIsIm5ldXRyYWxfcm91dGVkX2V2ZW50cyIsImFjdHVhbF9kaXJlY3RfZXZlbnRzIiwicmVzZXJ2ZWRfc3RhdGVfZXZlbnRzIiwicXVldWVfb3ZlcmZsb3dfZXZlbnRzIl19LCJwaHlzaWNhbF9tZWFzdXJlbWVudCI6eyJhdmFpbGFiaWxpdHkiOiJub3RfaW5fc2NvcGUiLCJjb3JyZWxhdGlvbl9zdGF0dXMiOiJub3RfZXZhbHVhdGVkIn19LCJtaWxlc3RvbmUiOiJNMTkg4oCUIE1hY2hpbmUtUmVhZGFibGUgTTE2IEV4ZWN1dGlvbiBhbmQgUXVhbGlmaWNhdGlvbiBFdmlkZW5jZSIsIm1vbml0b3IiOiJ2ZXJpZmljYXRpb24vbTE5L2ZycF9tMTlfbTE2X2V2aWRlbmNlX21vbml0b3JzLnN2IiwicXVhbGlmaWVkX3NvdXJjZSI6eyJicmFuY2giOiJtYWluIiwiY29tbWl0IjoiZWRlNTNjZiIsImNvbW1pdF9pZGVudGl0eV9mb3JtYXQiOiJzaG9ydF9naXRfc2hhIiwicmVzdWx0IjoiU1VDQ0VTUyIsIndvcmtmbG93IjoiLmdpdGh1Yi93b3JrZmxvd3MvZnJwLW0xNi1mcGdhLXByZXBhcmF0aW9uLnltbCIsIndvcmtmbG93X3J1biI6Mn0sInJhd190cmFjZSI6eyJieXRlX2xlbmd0aCI6Mzk2LCJmb3JtYXQiOiJmcnAubTE5Lm0xNl9leGVjdXRpb25fcmF3LnYxIiwicGF0aCI6ImFydGlmYWN0cy9tMTkvcmF3L20xNi1mcGdhLXByZXBhcmF0aW9uLWV4ZWN1dGlvbi50cmFjZSIsInJhd19zaGEyNTYiOiIwNTE2OGYzZDFlOWI1NmY2Zjk5ZmE1MDAxYTcwNTE2ODM1NTQzMWU5NzZiM2IxNTI5NzJkMmJjZWIwN2EzNDM5IiwicmVjb3JkX2NvdW50Ijo0fSwicmVjb3JkcyI6W3siYWNjZXB0ZWRfY2VsbF9pZHMiOlswXSwiYWNjZXB0ZWRfY2hhbmdlX2NlbGxfaWRzIjpbMF0sImNvcmVfcmVhZHkiOnRydWUsImV2ZW50cyI6eyJhY3R1YWxfZGlyZWN0X2V2ZW50cyI6MCwibmV1dHJhbF9yb3V0ZWRfZXZlbnRzIjowLCJwcmV2ZW50ZWRfZGlyZWN0X2V2ZW50cyI6MCwicXVldWVfb3ZlcmZsb3dfZXZlbnRzIjowLCJyZXF1ZXN0ZWRfZGlyZWN0X2V2ZW50cyI6MCwicmVzZXJ2ZWRfc3RhdGVfZXZlbnRzIjowfSwiZXhlY3V0aW9uX2Vwb2NoIjowLCJpbnZhcmlhbnRzIjp7ImFsbF9wYXNzIjp0cnVlLCJmbGFncyI6W3sibmFtZSI6InN0YXRlX2RvbWFpbl92YWxpZCIsInBhc3MiOnRydWV9LHsibmFtZSI6InNjaGVkdWxlcl9jb3VudHNfdmFsaWQiLCJwYXNzIjp0cnVlfSx7Im5hbWUiOiJyZXF1ZXN0X2xhbmVfb3JkZXJfdmFsaWQiLCJwYXNzIjp0cnVlfSx7Im5hbWUiOiJwZW5kaW5nX3BvbGFyaXR5X3ZhbGlkIiwicGFzcyI6dHJ1ZX0seyJuYW1lIjoiYWN0aXZlX25ldXRyYWxfdmFsaWQiLCJwYXNzIjp0cnVlfSx7Im5hbWUiOiJ0cmFuc2l0aW9uX2NhcGFjaXR5X3ZhbGlkIiwicGFzcyI6dHJ1ZX0seyJuYW1lIjoic3RhdGVfdXBkYXRlX3ZhbGlkIiwicGFzcyI6dHJ1ZX0seyJuYW1lIjoibm9fYWN0dWFsX2RpcmVjdF9ldmVudHMiLCJwYXNzIjp0cnVlfSx7Im5hbWUiOiJub19yZXNlcnZlZF9zdGF0ZSIsInBhc3MiOnRydWV9LHsibmFtZSI6Im5vX3F1ZXVlX292ZXJmbG93IiwicGFzcyI6dHJ1ZX1dfSwibmV1dHJhbF9yb3V0ZWRfY2VsbF9pZHMiOltdLCJwZW5kaW5nX3JvdXRlX2FmdGVyIjpbMCwwLDAsMCwwLDAsMCwwXSwicGVuZGluZ19yb3V0ZV9iZWZvcmUiOlswLDAsMCwwLDAsMCwwLDBdLCJwaGFzZV9kZXJpdmVkX3RhcmdldHMiOlsxLDAsMCwwLDAsMCwwLDBdLCJyZXF1ZXN0cyI6W3siYWNjZXB0ZWQiOnRydWUsImNlbGxfaW5kZXgiOjAsImxhbmUiOjAsInJlamVjdGVkIjpmYWxzZSwidGFyZ2V0X3N0YXRlIjoxLCJ2YWxpZCI6dHJ1ZX0seyJhY2NlcHRlZCI6ZmFsc2UsImNlbGxfaW5kZXgiOjAsImxhbmUiOjEsInJlamVjdGVkIjpmYWxzZSwidGFyZ2V0X3N0YXRlIjowLCJ2YWxpZCI6ZmFsc2V9XSwicmV0YWluZWRfc3RhdGVfYWZ0ZXIiOlsxLDAsMCwwLDAsMCwwLDBdLCJyZXRhaW5lZF9zdGF0ZV9iZWZvcmUiOlswLDAsMCwwLDAsMCwwLDBdLCJzY2hlZHVsZXIiOnsiY291bnRlcnNfYWZ0ZXIiOnsiYmFsYW5jZSI6MCwiY29tbWl0IjowLCJleGNpdGUiOjAsImZyZWUiOjEsIm5ldXRyYWxpemUiOjB9LCJtb2RlIjoiZnJlZSIsInN0YXRlIjoiZnJlZSIsInRpY2tzX2FmdGVyIjoxLCJ0aWNrc19iZWZvcmUiOjB9LCJzZXF1ZW5jZSI6MCwidGVsZW1ldHJ5Ijp7InN3aXRjaF9sb2FkX2Rlbm9taW5hdG9yIjo4LCJzd2l0Y2hfbG9hZF9udW1lcmF0b3IiOjEsInN3aXRjaF9sb2FkX3ExNiI6ODE5Mn0sInRyYW5zaXRpb25fY2FwYWNpdHkiOnsiYWNjZXB0ZWRfY2hhbmdlcyI6MSwiY2FwYWNpdHlfZXhoYXVzdGVkIjpmYWxzZSwiY2FwYWNpdHlfbGltaXQiOjIsImNhcGFjaXR5X3JlbWFpbmluZyI6MX19LHsiYWNjZXB0ZWRfY2VsbF9pZHMiOlswXSwiYWNjZXB0ZWRfY2hhbmdlX2NlbGxfaWRzIjpbMF0sImNvcmVfcmVhZHkiOnRydWUsImV2ZW50cyI6eyJhY3R1YWxfZGlyZWN0X2V2ZW50cyI6MCwibmV1dHJhbF9yb3V0ZWRfZXZlbnRzIjoxLCJwcmV2ZW50ZWRfZGlyZWN0X2V2ZW50cyI6MSwicXVldWVfb3ZlcmZsb3dfZXZlbnRzIjowLCJyZXF1ZXN0ZWRfZGlyZWN0X2V2ZW50cyI6MSwicmVzZXJ2ZWRfc3RhdGVfZXZlbnRzIjowfSwiZXhlY3V0aW9uX2Vwb2NoIjowLCJpbnZhcmlhbnRzIjp7ImFsbF9wYXNzIjp0cnVlLCJmbGFncyI6W3sibmFtZSI6InN0YXRlX2RvbWFpbl92YWxpZCIsInBhc3MiOnRydWV9LHsibmFtZSI6InNjaGVkdWxlcl9jb3VudHNfdmFsaWQiLCJwYXNzIjp0cnVlfSx7Im5hbWUiOiJyZXF1ZXN0X2xhbmVfb3JkZXJfdmFsaWQiLCJwYXNzIjp0cnVlfSx7Im5hbWUiOiJwZW5kaW5nX3BvbGFyaXR5X3ZhbGlkIiwicGFzcyI6dHJ1ZX0seyJuYW1lIjoiYWN0aXZlX25ldXRyYWxfdmFsaWQiLCJwYXNzIjp0cnVlfSx7Im5hbWUiOiJ0cmFuc2l0aW9uX2NhcGFjaXR5X3ZhbGlkIiwicGFzcyI6dHJ1ZX0seyJuYW1lIjoic3RhdGVfdXBkYXRlX3ZhbGlkIiwicGFzcyI6dHJ1ZX0seyJuYW1lIjoibm9fYWN0dWFsX2RpcmVjdF9ldmVudHMiLCJwYXNzIjp0cnVlfSx7Im5hbWUiOiJub19yZXNlcnZlZF9zdGF0ZSIsInBhc3MiOnRydWV9LHsibmFtZSI6Im5vX3F1ZXVlX292ZXJmbG93IiwicGFzcyI6dHJ1ZX1dfSwibmV1dHJhbF9yb3V0ZWRfY2VsbF9pZHMiOlswXSwicGVuZGluZ19yb3V0ZV9hZnRlciI6Wy0xLDAsMCwwLDAsMCwwLDBdLCJwZW5kaW5nX3JvdXRlX2JlZm9yZSI6WzAsMCwwLDAsMCwwLDAsMF0sInBoYXNlX2Rlcml2ZWRfdGFyZ2V0cyI6Wy0xLDAsMCwwLDAsMCwwLDBdLCJyZXF1ZXN0cyI6W3siYWNjZXB0ZWQiOnRydWUsImNlbGxfaW5kZXgiOjAsImxhbmUiOjAsInJlamVjdGVkIjpmYWxzZSwidGFyZ2V0X3N0YXRlIjotMSwidmFsaWQiOnRydWV9LHsiYWNjZXB0ZWQiOmZhbHNlLCJjZWxsX2luZGV4IjowLCJsYW5lIjoxLCJyZWplY3RlZCI6ZmFsc2UsInRhcmdldF9zdGF0ZSI6MCwidmFsaWQiOmZhbHNlfV0sInJldGFpbmVkX3N0YXRlX2FmdGVyIjpbMCwwLDAsMCwwLDAsMCwwXSwicmV0YWluZWRfc3RhdGVfYmVmb3JlIjpbMSwwLDAsMCwwLDAsMCwwXSwic2NoZWR1bGVyIjp7ImNvdW50ZXJzX2FmdGVyIjp7ImJhbGFuY2UiOjAsImNvbW1pdCI6MCwiZXhjaXRlIjowLCJmcmVlIjoyLCJuZXV0cmFsaXplIjowfSwibW9kZSI6ImZyZWUiLCJzdGF0ZSI6ImZyZWUiLCJ0aWNrc19hZnRlciI6MiwidGlja3NfYmVmb3JlIjoxfSwic2VxdWVuY2UiOjEsInRlbGVtZXRyeSI6eyJzd2l0Y2hfbG9hZF9kZW5vbWluYXRvciI6OCwic3dpdGNoX2xvYWRfbnVtZXJhdG9yIjoxLCJzd2l0Y2hfbG9hZF9xMTYiOjgxOTJ9LCJ0cmFuc2l0aW9uX2NhcGFjaXR5Ijp7ImFjY2VwdGVkX2NoYW5nZXMiOjEsImNhcGFjaXR5X2V4aGF1c3RlZCI6ZmFsc2UsImNhcGFjaXR5X2xpbWl0IjoyLCJjYXBhY2l0eV9yZW1haW5pbmciOjF9fSx7ImFjY2VwdGVkX2NlbGxfaWRzIjpbXSwiYWNjZXB0ZWRfY2hhbmdlX2NlbGxfaWRzIjpbMF0sImNvcmVfcmVhZHkiOnRydWUsImV2ZW50cyI6eyJhY3R1YWxfZGlyZWN0X2V2ZW50cyI6MCwibmV1dHJhbF9yb3V0ZWRfZXZlbnRzIjowLCJwcmV2ZW50ZWRfZGlyZWN0X2V2ZW50cyI6MCwicXVldWVfb3ZlcmZsb3dfZXZlbnRzIjowLCJyZXF1ZXN0ZWRfZGlyZWN0X2V2ZW50cyI6MCwicmVzZXJ2ZWRfc3RhdGVfZXZlbnRzIjowfSwiZXhlY3V0aW9uX2Vwb2NoIjowLCJpbnZhcmlhbnRzIjp7ImFsbF9wYXNzIjp0cnVlLCJmbGFncyI6W3sibmFtZSI6InN0YXRlX2RvbWFpbl92YWxpZCIsInBhc3MiOnRydWV9LHsibmFtZSI6InNjaGVkdWxlcl9jb3VudHNfdmFsaWQiLCJwYXNzIjp0cnVlfSx7Im5hbWUiOiJyZXF1ZXN0X2xhbmVfb3JkZXJfdmFsaWQiLCJwYXNzIjp0cnVlfSx7Im5hbWUiOiJwZW5kaW5nX3BvbGFyaXR5X3ZhbGlkIiwicGFzcyI6dHJ1ZX0seyJuYW1lIjoiYWN0aXZlX25ldXRyYWxfdmFsaWQiLCJwYXNzIjp0cnVlfSx7Im5hbWUiOiJ0cmFuc2l0aW9uX2NhcGFjaXR5X3ZhbGlkIiwicGFzcyI6dHJ1ZX0seyJuYW1lIjoic3RhdGVfdXBkYXRlX3ZhbGlkIiwicGFzcyI6dHJ1ZX0seyJuYW1lIjoibm9fYWN0dWFsX2RpcmVjdF9ldmVudHMiLCJwYXNzIjp0cnVlfSx7Im5hbWUiOiJub19yZXNlcnZlZF9zdGF0ZSIsInBhc3MiOnRydWV9LHsibmFtZSI6Im5vX3F1ZXVlX292ZXJmbG93IiwicGFzcyI6dHJ1ZX1dfSwibmV1dHJhbF9yb3V0ZWRfY2VsbF9pZHMiOltdLCJwZW5kaW5nX3JvdXRlX2FmdGVyIjpbMCwwLDAsMCwwLDAsMCwwXSwicGVuZGluZ19yb3V0ZV9iZWZvcmUiOlstMSwwLDAsMCwwLDAsMCwwXSwicGhhc2VfZGVyaXZlZF90YXJnZXRzIjpbMCwwLDAsMCwwLDAsMCwwXSwicmVxdWVzdHMiOlt7ImFjY2VwdGVkIjpmYWxzZSwiY2VsbF9pbmRleCI6MCwibGFuZSI6MCwicmVqZWN0ZWQiOmZhbHNlLCJ0YXJnZXRfc3RhdGUiOjAsInZhbGlkIjpmYWxzZX0seyJhY2NlcHRlZCI6ZmFsc2UsImNlbGxfaW5kZXgiOjAsImxhbmUiOjEsInJlamVjdGVkIjpmYWxzZSwidGFyZ2V0X3N0YXRlIjowLCJ2YWxpZCI6ZmFsc2V9XSwicmV0YWluZWRfc3RhdGVfYWZ0ZXIiOlstMSwwLDAsMCwwLDAsMCwwXSwicmV0YWluZWRfc3RhdGVfYmVmb3JlIjpbMCwwLDAsMCwwLDAsMCwwXSwic2NoZWR1bGVyIjp7ImNvdW50ZXJzX2FmdGVyIjp7ImJhbGFuY2UiOjAsImNvbW1pdCI6MCwiZXhjaXRlIjowLCJmcmVlIjozLCJuZXV0cmFsaXplIjowfSwibW9kZSI6ImZyZWUiLCJzdGF0ZSI6ImZyZWUiLCJ0aWNrc19hZnRlciI6MywidGlja3NfYmVmb3JlIjoyfSwic2VxdWVuY2UiOjIsInRlbGVtZXRyeSI6eyJzd2l0Y2hfbG9hZF9kZW5vbWluYXRvciI6OCwic3dpdGNoX2xvYWRfbnVtZXJhdG9yIjoxLCJzd2l0Y2hfbG9hZF9xMTYiOjgxOTJ9LCJ0cmFuc2l0aW9uX2NhcGFjaXR5Ijp7ImFjY2VwdGVkX2NoYW5nZXMiOjEsImNhcGFjaXR5X2V4aGF1c3RlZCI6ZmFsc2UsImNhcGFjaXR5X2xpbWl0IjoyLCJjYXBhY2l0eV9yZW1haW5pbmciOjF9fSx7ImFjY2VwdGVkX2NlbGxfaWRzIjpbMV0sImFjY2VwdGVkX2NoYW5nZV9jZWxsX2lkcyI6WzFdLCJjb3JlX3JlYWR5Ijp0cnVlLCJldmVudHMiOnsiYWN0dWFsX2RpcmVjdF9ldmVudHMiOjAsIm5ldXRyYWxfcm91dGVkX2V2ZW50cyI6MCwicHJldmVudGVkX2RpcmVjdF9ldmVudHMiOjAsInF1ZXVlX292ZXJmbG93X2V2ZW50cyI6MCwicmVxdWVzdGVkX2RpcmVjdF9ldmVudHMiOjAsInJlc2VydmVkX3N0YXRlX2V2ZW50cyI6MH0sImV4ZWN1dGlvbl9lcG9jaCI6MSwiaW52YXJpYW50cyI6eyJhbGxfcGFzcyI6dHJ1ZSwiZmxhZ3MiOlt7Im5hbWUiOiJ